"DESCRIPTION","DURATION IN MS","NAME","PARENT SUITE","START TIME","STATUS","STOP TIME","SUB SUITE","SUITE","TEST CLASS","TEST METHOD"
"","9258","verify the ability to sort products in descending order by price","UI_tests","Thu Mar 13 10:40:35 GMT 2025","passed","Thu Mar 13 10:40:44 GMT 2025","menTops","menTops.spec.js","",""
"","2226","5th card: clicking the card image redirects to the respective product card","UI_tests","Thu Mar 13 10:39:15 GMT 2025","passed","Thu Mar 13 10:39:17 GMT 2025","homePage.spec","homePage.spec.js","",""
"","6178","after applying the filter Jackets, only jackets are displayed on the page","UI_tests","Thu Mar 13 10:40:44 GMT 2025","passed","Thu Mar 13 10:40:50 GMT 2025","topWomenPage.spec","topsWomenPage.spec.js","",""
"","2182","Check navigation and deal section to the Sale page","UI_tests","Thu Mar 13 10:39:16 GMT 2025","passed","Thu Mar 13 10:39:18 GMT 2025","salePage.spec","salePage.spec.js","",""
"","1976","Check that all required fields are presented and empty in ""Create New Customer Account"" form","UI_tests","Thu Mar 13 10:41:00 GMT 2025","passed","Thu Mar 13 10:41:02 GMT 2025","createAccuntPage.spec","createAccountPage.spec.js","",""
